{
    "$schema": "https://json-schema.org/draft/2020-12/schema",
    "$id": "https://github.com/aDelgado13/MAGNETISiM/tree/main/schemas",
    "title": "Simulation Settings",
    "type": "object",
    "properties": {
        "SimName": { "type": "string" },
        "MagnetCheck": { "type": "boolean" },
        "maxError": { "type": "number" },
        "NominalFreq": { "type": "number" },
        "ACType": { "type": "string" },
        "SweepType": { "type": "string" },
        "f_min": { "type": "number" },
        "f_max": { "type": "number" },
        "n_points": { "type": "integer" },
        "NomIncluded": { "type": "boolean" },
        "WaveformAC": { "type": "string" },
        "nHarm": { "type": "integer" }
    },
    "required": ["SimName", "NominalFreq"]
}